name,user,stars,review
Emily Provincial Park,Justin Majik,4,Excellent park. Came here as a kid and brought my family here in June of 2018. Pigeon river is very weedy for fishing but if you find a spot you can get some nice fish bass/musky. Facilities were clean and the beach was consistently ranked in the mornings. Awesome dock for your boat/fishing as well.
Emily Provincial Park,Radhu Vijay,5,Nice park to visit during summer months. Charcoal Barbecue is allowed. Children’s play area is nearby the water.
Emily Provincial Park,selam belete,4,"I had a fantastic time at Emily park. Was there for 6 nights with 3 kids ages 8 to 10. They enjoyed their time at the south beach, swimming, fishing and walking the short trails. Truly speaking, the park and what it has to offer is good. ..."
Emily Provincial Park,Hailey Batchelor,5,"Have been going here since my childhood and it's a fantastic park for camping. The trails are great, they've done lots of work on them.  Every campsite has decent privacy on at least 2 sides from my experience. Washrooms are always in ..."
Emily Provincial Park,Sarah Nisbet,4,We had a great experience at Emily park. I think it definitely depends on what type of camping you're looking for. We could hear a lot of other people but the wardens must have done a good job as they mostly quieted down shortly after ...
Emily Provincial Park,Jaison Parayil,4,"Our family enjoyed the beach (there's 2 small ones to choose from), and the playground, but we really appreciated the shows and activities that were put on by staff.  Shower/toilet facilities were relatively clean too.  Will return again."
Emily Provincial Park,Sheryl Evans,5,Love this park. The washrooms we are using are some of the best we've experienced. Love that there's place for all your stuff and sufficient hangers! Staff are awesome as well. Very polite and helpful.
Emily Provincial Park,Lisa Synard,3,Clean park as expected from most provincial parks. The staff are very nice. The sites were ok. Our site was great. Large with a decent amount of tree cover but some people in our party had sites that weren't as private. The beach was ...
Emily Provincial Park,brent Chase,4,"PLEASE READ.
Remember you are in nature's back yard.
Site 211 has a permanent thief that lives and steals. Yes, this is not a joke.
Red squirrel steals lighters, keys, buns, or anything you may need under your screened In gazebo. Don't hurt him or them. They don't know any better."
Emily Provincial Park,Lisa Chan,4,Nice clean place with family-friendly activities and friendly staff. One thing that is needed is a few more informative directional signs to key areas like the Beaches and Convenience Store. I helped someone looking for the convenience ...
Emily Provincial Park,Gary Mark,5,"Stayed here for a few days in August 2018.  Staff are absolutely amazing.  The site we stayed at (#307) was huge, but had a pretty hefty slope to it.  I had run out of 6x6 to try to level out the trailer.  I asked staff at the front of ..."
Emily Provincial Park,Ian Emmons,4,"Spent 3 nights at Emily in August. Its a fairly large campground. Has equipment rentals, a parks store of course, and the two boat launches are very well kept, with new docks and parking lots."
Emily Provincial Park,Magdalena Stoeva,5,"Great little park. Close by to a city. Clean facilities, tons of programs for younger kids. The beach area was nice, but the 'sand' was more clay like, kids enjoyed getting dirty and building things. Needs an EV charger."
Emily Provincial Park,Paul Kuznecov,4,"Really nice park but they need to have a nice place for dogs to swim. Currently they can only go in the water at boat launches which are weedy and dirty. Staff are friendly and helpful, sites are private and beautiful. We stayed on circle and it was great. We cant wait to go back."
Emily Provincial Park,Jennifer Wilson,3,"Lovely campground - very private.  Our campsite (108) was also very nice.  However, we had heavy rain our first night, and quickly discovered that we were at the lowest point in the park - rain run-off from three different roads flowed ..."
Emily Provincial Park,simon mak,3,The beach is full of algae and water is not as clean as the southern part of Toronto beaches. The camp is not big and easy to go around on bike. Camp staff is very friendly and helpful. Washroom and shower room are cleaned frequently. We stayed on RV site and overall is quiet.
Emily Provincial Park,Laurette Ginglo,4,Yes go there every year for a Family reunion annually on the September Long Weekend.  The guy at the front desk this past year was ignorant and really was not helpful in anyway and directed us in the wrong direction to the open Family ...
Emily Provincial Park,Diana Barbour,5,I really like camping at emily park. The sites are nice and big and the beach is nice for the grandchildren. Unfortunately I can't take my dog on the beach even though I always pick up after him. But those who don't spoil it for those who do. The staff are very friendly and the park is very clean.
Emily Provincial Park,Jon Douglas,5,Super clean with great showers. Walking trail is very short but the boardwalk is finally being rebuilt.
Emily Provincial Park,Brian Bad,4,"This is my first time camping at Emily Provincial Park. Campground is very nice. Bathrooms are modern and are fairly clean with a large amount of shower capacity, 7 shower stalls where I was at. I've read other reviews about the beach ..."
Emily Provincial Park,andrew robertson,3,"Overall decent experience good staff at the gate and terrific staff at the parks store, but we were on the same group site as we have been on for the last several years, and they still haven't fixed one of the washrooms that's been out ..."
Emily Provincial Park,Diana Robson,3,"The park is smaller compared to other provincial parks and it has two nice beaches , however no dogs are allowed on the beach. We stayed at one of the group campsites and it was beautiful however there were only two comfort stations for a campground with 320 campsites so be prepared to line up especially on a long weekend."
Emily Provincial Park,Dave Spence,3,"If you get to the park too early, meaning before anyone in the booth is there. Look out for the pay area and place your slip on the dash. Was there a few ago fishing, didn't see any pay spot, so went into the park, figured I would pay on ..."
Emily Provincial Park,Veronica Lord-Annis,4,They made renting a canoe for the afternoon very easy. I will definitely be back to see more of the river.
Emily Provincial Park,kaitlyn D,5,We are regular campers at Emily. Love the size of the park. Love the beach. Our young kids always have a blast.
Emily Provincial Park,j whyte,4,Great place to camp. Most spots are good sized. Very friendly and helpful staff. Clean bathrooms. 2 beaches and boat launch little store.
Emily Provincial Park,Dave Weicker,5,Stayed 2 nights June 2018. Huge site #286! Quiet at night. A little noise from nearby highway. Staff were all friendly and helpful. New upgrades to some roads and the dump and fill stations. Definitely book here again.
Emily Provincial Park,linda stewart,3,"The RV sites are beautiful, the staff very friendly and efficient. I have never seen such fabulous fill aand dump stations.

  I found the ladies ""outhouse?"" by the centre beach deplorable. It was dirty and because I was desperate I used ..."
Emily Provincial Park,Jade Legacy,5,This is the most amazing provincial park. It's so beautiful. The beach is amazing for campers. The public use beach is ok but still pretty good. The playground for kids is really neat. Definitely worth the trip.
Emily Provincial Park,Gangsta Bob,3,Usually only go here for the group sites. Has many differnnt water fun things for rent like paddle boats and canoes.
Emily Provincial Park,Willy Weiss,4,"Waterfront nice, sites a good size. Bug free this mid Aug weekend. No water connection @sites."
Emily Provincial Park,Okan Korsal,4,Nice big private campsites. Water taps are almost inside the campsite and is shared between 2 or 3 other campsites.
Emily Provincial Park,Belinda Junkin,4,"I have camped at Emily Provincial Park a few times each year.  It has a nice beach for children to play and docks setup to allow campers and children to fish, which I haven't found at many provincial parks.  I have always camped on the ..."
Emily Provincial Park,Maria,5,Clean facilities and a nice beach. I really liked this campsite and the hiking trails (although they were short)
Emily Provincial Park,Meg Pill,3,"Not a bad place, but not worth a long drive just for camping. Just an every day place."
Emily Provincial Park,Andrew Hannaford,3,"Good park, busy and small. Nice area and good for boats though. Bathrooms could be redone as they're showing their age."
Emily Provincial Park,Syed Shahenshah Hussain,5,"Had a terrific weekend, as part of a campaign. Heard from other folks at the park that it's better than other provincial  parks around the East end."
Emily Provincial Park,jason m,2,Used to be a great park. Now wardens must have have something better to do at nights. Drinking and yelling all night with adults peeing all over their sites. Bad experience this time 😠
Emily Provincial Park,Johnny Lim,3,"Not a bad camp site the staff try to keep everything clean, except the beach need some work."
Emily Provincial Park,MissHexe,1,"Emily Park isn't going to waste anymore of my time by writing a detailed review, but long story short.. We've been here a couple years ago and it was the best weekend we've had. We went labour day weekend this year, and it was a waste of ..."
Emily Provincial Park,Derek Kwan,4,Nice campsite. Lots of activities for kids. Just wish there are more showers for each camp ground.
Emily Provincial Park,ryan inget,5,Beautiful clean park a true must stay provincial park
Emily Provincial Park,Tina Nguyen,3,"The park was nice and quiet.camping site was nice but small dinky beaches,water was dirty"
Emily Provincial Park,Cassidy Brown,1,"I am only giving them a 1 star because there isn’t the option to give none. 
Rudest staff ever. 
The moment we got to the camp we had 2 vehicles and on the website it said 2 are free but you have to pay for a third they made up pay even ..."
Emily Provincial Park,Baris Tumok,2,"I'm here at the moment, super disappointed and extremely angry with myself because I booked this weekend without making enough research.

I go camping to be in the nature, to be away from the city lights and noises. At the moment I'm in ..."
Emily Provincial Park,Marietta Castro-Vega,4,"The park itself is good, the staff great but our camp site was littered with garbage kids candy wrappers, beer caps etc. Really parents this is how you teach your kids to be respectful of nature"
Emily Provincial Park,Jen C,5,Beautiful quiet park close to home and nearby small towns.
Emily Provincial Park,Isaac J,4,"Decent park. The facilities are well maintained and the staff are pleasant. Apart from that, nothing special about this place. Just easy access to the water, and the lake can be quite nice. Hiking is limited (you're better off exiting ..."
Emily Provincial Park,Kari Murphy,5,The best camping trip......so far😉
Emily Provincial Park,William Scott,3,Wasnt here just close bye
Emily Provincial Park,Justin Rebelo,5,"Great staff, Friendly, cleanest facilities I've ever been to at a provincial park campground."
Emily Provincial Park,Duncan Irving,5,"Great park, nice big sites, great beaches"
Emily Provincial Park,Megan Taylor,3,"It's a very small provical park. With only one beach area. The water is not the best for swimming. It's good if u just want a quick weekend getaway or if u have small children, since the swimming area is very shallow with a sandy beach."
Emily Provincial Park,Jeremy McLeod,4,"Clean, well maintained.  Close to GTA."
Emily Provincial Park,Richard HMcVey,3,"Big site, beautiful pigeon river."
Emily Provincial Park,Megan Burnett,5,Great for all ages
Emily Provincial Park,Don Buchanan,5,Really quiet and very clean...even the bears 🐻 are friendly.
Emily Provincial Park,magicn3ss,5,Favourite park. Very clean bathroom and well kept sites.
Emily Provincial Park,Greg Wildeboer,4,"Respectable park,  very clean and beach is average."
Emily Provincial Park,Matt Gray,5,"We love Emily Park, it's nice and close and we always have a great time camping there."
Emily Provincial Park,Michael Bonner,5,"My first time ever going camping, and I would definately go back here again before the summer is over."
Emily Provincial Park,tobyguy a,4,Fun environment.. family campng
Emily Provincial Park,Phil Fox,5,Same friendly staff and well cared for facilities.
Emily Provincial Park,glen ogden,3,Quiet large sites beach area not great.  Poor swimming area for dogs
Emily Provincial Park,John Maier,4,Emily was a nice surprise.  The park is not that big but well kept.  Our site was very private and backed onto the beach.  The beach was groomed and is great for kids.  The boat launch was well taken care of.  It had a simple but ...
Emily Provincial Park,J. R.,4,This place is nice but has really changed quite a bit in the last few years. The popular boardwalk nature trail was closed and the second beach was closed. It's a nice place to canoe if you but on the weekends motorboats regularly drive ...
Emily Provincial Park,rabsalan,5,Very nice place
Emily Provincial Park,Darren Conlan,5,"Very nice park, good sized sites."
Emily Provincial Park,Ryan Wong,4,Nice lake you can fish in ( perch)
Emily Provincial Park,The HandyBoydz Inc.,5,Awesome camp grounds
Emily Provincial Park,Rob Armstrong,4,Nice clean organized park.
Emily Provincial Park,Melodie Messina,5,Quiet clean park. Plenty of activities for kids. Beach area is great.
Emily Provincial Park,Dave Lindgren,4,Excellent park for day and overnights.
Emily Provincial Park,Jason Hett,5,Great place going again another time
Emily Provincial Park,James Laite,5,I may be biased as my brother got married here... but it a gorgeous park with spaces you can rent for events or trails just to enjoy... we have alot of parks in canada but this one stands out in my mind
Emily Provincial Park,Kim Rimes,5,"Came to Emily Park as a child. Now, years later, I frequent the park with my own family. It is a yearly tradition for us. Park staff is wonderful, sites are a great size and comfort stations are usually clean. My kids are always excited ..."
Emily Provincial Park,The GraphixGuy,4,"Beautiful, quiet, scenic areas with the cleanest washrooms and hot shower facilities. Lots of room for tents and RV campers and laid-out hiking trails. This is a place to stay again and again."
Emily Provincial Park,john Barnard,4,"Nice park, but constant road noise."
Emily Provincial Park,Emily M,5,This park is great for walkers. I can easily do the entire park in one afternoon and I am quite out of shape reasonably sized ice cream washrooms are clean. Good programing if you want to stay to watch it (day passes expire at 10pm)
Emily Provincial Park,glen ogden,3,All was good.   Exception being no pet access to water at the beach.   My dogs are better behaved then the kids running loose here
Emily Provincial Park,William Melhuish,5,Great camping spot
Emily Provincial Park,Jamie Chou,4,Good place for swimming  and fishing
Emily Provincial Park,rob sanderson,5,Peacefull and clean
Emily Provincial Park,A TO Z Metals,5,"Great park , Great Staff"
Emily Provincial Park,Henri van Bemmel,5,"Excellent campsites with good privacy in the circle campground. Ontario parks camping fees are far too high $51+ / night, but I like camping in parks far more than commercial campgrounds"
Emily Provincial Park,Orion Boyes,1,Place is only for kids and family's. Park rangers will nonstop harass you otherwise. They even told us they were following us on our 30 min nature walk just because. There was no pretense of suspicion. Unfortunately it wasn't busy that ...
Emily Provincial Park,Linette Gowe,5,We enjoyed camping at emily provincial park🏕⛈🌨☀️🌜🌟☔🎣🚴‍♀️🏸⚽️🚵‍♀️✨☕🍌🍓🍒🍍🍉🍔🍟🥓🍗🧀🌭🍳🍝🍜🍲🍩🍰🎂🍫🍭🍨🍧🍦🍺🍷🍸full fun with all FRIENDS COME TOGETHER😃😄😅🤣😂😆😁😍😘🤗😉😊
Emily Provincial Park,Nidhi Bhavsar,4,Nice camping place.
Emily Provincial Park,N James,4,"Nice park. Good services. Lake has a lot of weeds but still good for swimming. Campsites can be a little muddy, bring a tarp."
Emily Provincial Park,Fat Guy Outdoors,5,"Great park, and great people."
Emily Provincial Park,Ryan Bean,4,Sites are all relatively good. The beaches can be closed sometimes depending on the bacteria content of the river and the beaches are also pretty small.
Emily Provincial Park,Eric strongestkarate,4,"Joined the learn to camp program with our 3yr old son. Place is very convenient, clean washrooms and safe.
The guides were amazing (Nik and team). Friendly and knowledgeable staffs.

Place is highly recommended for kids with young children. They also have a place to fish and gears you can borrow for free."
Emily Provincial Park,Pauline Robblee,2,"Reserved from Jun 08-11/17.  First of all, had to move from site 248 to 252 because ground too wet!  Understandable however there was a huge pile of gravel in front of our site which made it impossible to maneuver our 39' RV plus pick up ..."
Emily Provincial Park,Teresa Jordan,5,Favourite summer time place
Emily Provincial Park,Colin Schrank,3,Beach sucks not good swimming conditions but campsites are large.
Emily Provincial Park,harin weera,5,"Very relaxing and serene camp site. Other campers are respectful and curtious. Staff are very helpful and inviting.
CPAP friendly; must bring extension cord.
Did not try any of the water activities as it was very windy."
Emily Provincial Park,Leigh Clewlow,5,Great camping experience. Clean park. Water is weedy but beach area was great.
Emily Provincial Park,Monica Barber,4,Great place to camp.
Emily Provincial Park,adam anderson,5,"Great park. Come here every year, always clean and friendly people"
Emily Provincial Park,Kelly Unwin,4,"I camp here almost every year, and enjoy having a consistent campground that always suits our needs. Nice sites for tents, though some of the RV sites are very open/no privacy. Beaches are small but nice, and rarely busy. Fishing is good, plenty of sun fish and bass around. Nice quiet little park."
Emily Provincial Park,Kody Walton,5,Great place for time away for you and your family. I go there every summer 
Emily Provincial Park,AJ Alexander,3,"Overall, not a bad park.  Took just my son for 2 nights.  Fishing wasn't that great though, way too many weeds close to shore.  
We booked a campsite backing right onto the beach (#140).  It was quite convenient, but although there were cedars blocking the view between the site and beach, it was quite noisy."
Emily Provincial Park,Hubert Nguyen Trieu,4,Too many alge and weeds in water
Emily Provincial Park,Dave Long,4,"It's close to the people who live East of Toronto. Easy to get to and staff are very friendly. It has 2 beaches and water equipment to rent plus you can borrow PDF and fishing gear. Water is nice, but a little swampy, but lots of people were in it. It has a decent beach.   Boat launch on site with lots of docks. "
Emily Provincial Park,Shyla Grantmyre,3,"Decently private campsites, but the beaches are gross.. All seaweed and bacteria.. They closed one beach because of e.coli while we were there.. "
Emily Provincial Park,Shane Brydon,5,Super nice. Well kept
Emily Provincial Park,Ter Bear,5,One of our favorite paces to go. Especially Halloween  (thanksgiving ) weekend. Been going for this 4 years in a row. Won't ever miss one - the kids love it !
Emily Provincial Park,Shawn Eddison,5,Great family park.
Emily Provincial Park,MJ Baron,5,Great place !!
Emily Provincial Park,Mit Patel,5,"Great park for just a visit for the day or camping! Views are pretty good, but nice and quite area"
Emily Provincial Park,Ericson Evangelista,4,Park staff are nice...beach area are safe fir the kids but parents should watch their kids while swimming .
Emily Provincial Park,MJ Baron,5,"Awesome every year I have been there
Staff very helpful"
Emily Provincial Park,Cathy Richardson,5,"Love the park, had a fun and relaxing time. 
We will be back"
Emily Provincial Park,Jason Robertson,4,Nice park with mature trees and decent privacy between sites.
Emily Provincial Park,Peshtaz Karimi,5,"Fantastic Camping park, the sites are well kept, clean and quite, the staff are friendly, stayed here for 2 nights and loved the time."
Emily Provincial Park,Amanda Dew,4,What a lovely park. Lots of beautiful trees.  Lots of sites. Wasn't busy at all. Everything is so well maintained. Love to come back next year.
Emily Provincial Park,Rasta Fari,5,Awesome place
Emily Provincial Park,Grant Williams,5,Great camp ground. Lots to do and close enough to town.
Emily Provincial Park,susan van der groef,5,Beautiful and quite
Emily Provincial Park,Raspberry Canoe,5,Great park to launch a boat and rip up to Bobcageon. 
Emily Provincial Park,Jamie Cole,4,Close to home and the grounds and washrooms are kept clean. Always our first destination of the season. 
Emily Provincial Park,Maryam Dadhiseth,5,Great camping area for family kids and all
Emily Provincial Park,Dawn Cosgrove,3,"Have camped many times at Emily but this year not the best, unfortunately only a couple selections for sites and the one picked was not the greatest. Party central which continued through entire night on the Friday to Saturday morning ..."
Emily Provincial Park,Becky Irvine,4,"We have a great site, quiet. My only complaint is that to have an additional vehicle allowed in is $50+. For one night. "
Emily Provincial Park,Gordon Slaunwhite,5,Just a beautiful spot. Took the kids here many years ago as toddlers and I'm so happy to be able to return clean showers and clean bathrooms. Thank you staff for hosting us very very happy
Emily Provincial Park,Kirk Wiscombe,5,Beautiful little place
Emily Provincial Park,Rich K,5,Great n affordable place for the family
Emily Provincial Park,Lukas Natareno,5,"I came here to go camping and loved the fishing and area, its just down the street from peterborough so you dont need to look far for supplies or food. I managed to pull a huge 4 pounder largemouth from the docks!"
Emily Provincial Park,Tamas L,5,"Fantastic place 
We had so much fun with the kids"
Emily Provincial Park,Aaron Sloan,5,Always excellent!
Emily Provincial Park,Steve Hoskins,4,Sites are very big and in great shape.
Emily Provincial Park,Holly jeez do,1,There is no zero star otherwise i would put that on Emily Provincial Park campground.We went as a big group  last weekend our sites were cancelled due to rain and it was really muddy and we got 1 site which was very big and other sites ...
Emily Provincial Park,Steve Devocht,4,Friendly staff. Well priced and taken care of 
Emily Provincial Park,Jose Dias,4,Nice little park just a stone through away from Peterborough. 
Emily Provincial Park,Kim Allaby,5,Great for a Winter walk.
Emily Provincial Park,achinius pubius,3,"A real swell place to camp with friends, and summon the tree people. 3 stars due to the fact we were unable to do so on park grounds.
Would return again"
Emily Provincial Park,Stephanie Morse,5,"I've stayed here several times. It's never been too busy,  so it feels very private. The lake is beautiful and I love the Cedars loop despite the mosquitoes. "
Emily Provincial Park,Lynn Dafoe,4,i have only been there once injoyed my stay will be going back
Emily Provincial Park,Whole Dog Now,5,Can't say enough good things about this park and the staff. Amazing!
Emily Provincial Park,William Scott,3,Provincial park i see it driving by but never been in there
Emily Provincial Park,Lucas Wong,5,great staff
Emily Provincial Park,Tumesh Ashmid,5,Me and couple of our family always go here every year! Love the staff. Love how it's clean. 
Emily Provincial Park,Mike F,5,"Good sized camping spots, nice beach."
Emily Provincial Park,Geoffrey Campbell,4,Nice park with big sites.
Emily Provincial Park,Cassandra A,3,"Our camp site was located in the  circle campground, site 225. The site had uneven ground and very uncomfortable.   The upside is that the site is close to the washroom and water hole."
Emily Provincial Park,Bonnie Desbiens,5,"Been camping here since 1982 with kids. Now kids camp here. Love the park. Clean, beautiful park, friendly staff,  fun swimming. Close to Linds or Peterborough. Lots to do in the area. I recommend this park to everyone. You can't please everybody. "
Emily Provincial Park,robert bumbacco,3,To many restrictions.
Emily Provincial Park,Andre Hudgson,4,Nice
Emily Provincial Park,Bob Root,5,A wonder full place always
Emily Provincial Park,Ian Stringer,5,Great family campsite. Lots for the kids to do and see. Clean facilities and nice beaches. Ice and wood cost a bit much but it's not far to a shop to get your own.
Emily Provincial Park,Kevin Harmidy,5,"Beautiful area, camping spots have a good amount of privacy. Nice beach to swim "
Emily Provincial Park,Dan Luchian Deng,5,"This is the second time our church group camping at Emily Park. We are satisfied with the facilities, services, environment, almost everything. This year I had small problem when I booked the group camping site in the spring time; the ..."
Emily Provincial Park,Jacqueline Colley,3,"The park itself is great, the only downfall is year after year the cleanliness of the comfort stations is going down. The park staff try so hard to keep it clean but more and more dirty people are camping here each year, during the week it's not so bad but on weekends (more so on long weekends) it's nasty!"
Emily Provincial Park,Phyllis Swerdfiger,5,Is very accessible for ♿
Emily Provincial Park,Rm Rutherford,4,Good place to go.
Emily Provincial Park,aaron patel,4,Kids had a blast. Staff were great. Very accommodating 
