name,author_name,author_url,profile_photo_url,rating,relative_time_description,text,time
Port Burwell Provincial Park,Liz Cowie,https://www.google.com/maps/contrib/109526125313030031281/reviews,https://lh3.googleusercontent.com/-nvgtgMJn3zQ/AAAAAAAAAAI/AAAAAAAAB9Y/9z1OXYgqdjo/s128-c0x00000000-cc-rp-mo-ba2/photo.jpg,5,4 months ago,So beautiful here.  We stayed 1 week on a ravine site. One of the unreservable sites. We were lucky to get it on the last week before school. Truly the nicest sites there. Washrooms facilities were exceptionally clean and lots of showers with HOT water and were free.!!  BONUS.   lots of stuff for kids to do.  Well run park.  Beach is far away but well worth the walk or drive. Stunning beach and great swimming. Loved the area for exploring and shopping.  We found great deals in produce from local Mennonite stalls and farms.,1536414561
Potholes Provincial Park,Melinda Shelford,https://www.google.com/maps/contrib/110194969092050960035/reviews,https://lh4.googleusercontent.com/-KBJUiUwJJsg/AAAAAAAAAAI/AAAAAAAAAhg/hFYrAiLGqK0/s128-c0x00000000-cc-rp-mo-ba2/photo.jpg,5,a week ago,"This place is beautiful!! I go every summer. There are multiple swimming places, many you just have to climb down to. There is a shallow area I always see families near the ""entrance"". 
If you want to hike, park at the lower parking lots, but if you want to swim, you want to be at the further parking spots. You will still have to walk 10-15 mins to any good spot.",1547846152
Potholes Provincial Park,Tanya Circosta,https://www.google.com/maps/contrib/118176107115769866714/reviews,https://lh3.googleusercontent.com/-6k1Guq1ZwG8/AAAAAAAAAAI/AAAAAAAAAAA/ACevoQMaJdza3rcwiGPZIT7QZJNCEdP9bQ/s128-c0x00000000-cc-rp-mo-ba4/photo.jpg,5,2 weeks ago,"A beautiful place! A hidden gem that isn't usually suggested as a top 10 place to visit in this area. The hike along the trails is a lovely walk.  Beautiful scenery and a fun place to look for bears, but we didn't see any.",1546962557
Potholes Provincial Park,Jessica Kirkwood,https://www.google.com/maps/contrib/110148015739576592280/reviews,https://lh6.googleusercontent.com/-W3Lu3hIYc7c/AAAAAAAAAAI/AAAAAAAAAAA/ACevoQMe6MawdXKItwQQGxgxK5e11Cm3LA/s128-c0x00000000-cc-rp-mo-ba4/photo.jpg,5,2 weeks ago,Absolutely stunning. Went for a New Years Day hike. Found some fantastic waterfalls - always on the hunt tor falls to shoot. The trail has great little lookouts along the way. Can go as far or short a hike as you want. Different parking lots along the way. Great start to 2019.  Can’t wait to go back,1547104955
Potholes Provincial Park,m h,https://www.google.com/maps/contrib/116617386274649817416/reviews,https://lh5.googleusercontent.com/-p0QwewAoW70/AAAAAAAAAAI/AAAAAAAAAAA/ACevoQPLAZuNfiyRBZa7VIhbK8Kcy8D8nA/s128-c0x00000000-cc-rp-mo-ba2/photo.jpg,5,a month ago,This is one of my favourite place to visit on the island. It very scenic and a great place to take a dip. Water is a little cool so go on a hot summers day.,1546020232
Potholes Provincial Park,Regis Denefle,https://www.google.com/maps/contrib/109048329001428767886/reviews,https://lh4.googleusercontent.com/-C2NVACfqAFA/AAAAAAAAAAI/AAAAAAAAAt8/eBrB20BaWBQ/s128-c0x00000000-cc-rp-mo-ba4/photo.jpg,4,2 months ago,"Beautiful location. In the right weather you can swim, which is a great experience. Cool destination for a half day trip or full day depending on the time you have.",1542301659
Presqu'ile Provincial Park,Thierry Josic,https://www.google.com/maps/contrib/115125123106501726606/reviews,https://lh4.googleusercontent.com/-sSyPQlufFew/AAAAAAAAAAI/AAAAAAAAGlA/fT94yy8_Jcc/s128-c0x00000000-cc-rp-mo/photo.jpg,5,in the last week,"A treasure located a mere 158KM/ 2hrs drive from downtown Toronto, where so many amazing summer days have been spent. Due to the warm fall in Southern Ontario this year, we even had a beach day in September. The waters here are very shallow and warm up fast and stay warm. Walk out on the soft sandy bottom and gaze at the vast beach far behind you - with water barely up to an adults waist. Go out a little further to find deeper water for swimming. Kids can stay close to the shore and enjoy the shallow warm waters. 

In addition to being a great spot to visit, we love the drive to and from Presqu'ile Park. There really are few places like Prince Edward County. After a few hours on the beach we usually go for a drive and explore the countryside around the park. 

A perfect day-trip for us city-folk looking to forget the rat-race, even for a day.

Note: Bring everything you need - amenities are few and far between at the park. Basic washrooms/ change rooms are located by the beach parking. Stop in Brighton for your supplies on your way there. Also, there is no shelter to speak of, so umbrellas/ tents etc. for shade are recommended, especially if you have little ones.",1548434863
Presqu'ile Provincial Park,samanthi de zoysa,https://www.google.com/maps/contrib/100473886524718491822/reviews,https://lh6.googleusercontent.com/-iU3QyV3EOqs/AAAAAAAAAAI/AAAAAAAAAAA/ACevoQMAgE4oGp_dUJMQjf-MwJA6MYXzGA/s128-c0x00000000-cc-rp-mo-ba4/photo.jpg,4,a week ago,Beautiful park for a day trip. Not too far from Toronto.  Next to lake Ontario.  Even on the hottest of days you have  a good time as there is a lovely breeze and the water is cool and refreshing.  Lots of nice campsites too.,1547781465
Presqu'ile Provincial Park,Nishanth Paramsothy,https://www.google.com/maps/contrib/107996111929334256333/reviews,https://lh4.googleusercontent.com/-Mk_KiL-k8Jo/AAAAAAAAAAI/AAAAAAAAA6g/CkMuZFGuAAE/s128-c0x00000000-cc-rp-mo-ba4/photo.jpg,4,3 months ago,"Beautiful park and always well maintained.  Usually pretty busy during the summer months (as per other Provincial parks).  However, if you go past the busy seasons, and get there early enough, you can catch an epic sunrise and the beautiful colors that come from it.  Also, going early also provides the added benefit of having the park to yourself.",1539724755
Presqu'ile Provincial Park,Reza Sadreddin,https://www.google.com/maps/contrib/111408612344350402516/reviews,https://lh4.googleusercontent.com/-bR0HUzjFX6c/AAAAAAAAAAI/AAAAAAAAHPI/XHJnYBJIOKM/s128-c0x00000000-cc-rp-mo-ba6/photo.jpg,5,4 months ago,"A best relaxing place for a Sunday or any day afternoon. All nature in a good shape. Lots of facilities. You pay for visiting but  it worth it especially in autumn every tree shows a different colour. In addition to forest, beaches and a lagoon and a lighthouse and a natural museum are among the interesting attractive places. You may go inside by a car by a bike or even just walk inside you will love it.",1537194269
Presqu'ile Provincial Park,Jenna Beermann,https://www.google.com/maps/contrib/114487279042184223823/reviews,https://lh5.googleusercontent.com/-A7jZ3-pmIr8/AAAAAAAAAAI/AAAAAAAAA8c/ZOAzqBGEkm8/s128-c0x00000000-cc-rp-mo/photo.jpg,4,4 weeks ago,"Their comfort stations were easy to access and open 24hr. However had lots of large spiders. 
Beautiful convenient beach areas with swimming access.",1546284604
Quetico Provincial Park,Adam Wigdor,https://www.google.com/maps/contrib/104093368637917734487/reviews,https://lh5.googleusercontent.com/-VABUzGUnr1E/AAAAAAAAAAI/AAAAAAAAAAA/ACevoQP3SCNyKVURhhQhVMUK_WMBw_x3Rw/s128-c0x00000000-cc-rp-mo-ba3/photo.jpg,5,2 months ago,The one and only! Voyageur Wilderness Program is a great place to start and/or finish your trip too! They offer some of the best fully outfitted trips out there!,1543027331
Quetico Provincial Park,ernesto graveran,https://www.google.com/maps/contrib/101604187493040182255/reviews,https://lh3.googleusercontent.com/-p7r4sagt_lc/AAAAAAAAAAI/AAAAAAAABrA/_ly3VNMSNls/s128-c0x00000000-cc-rp-mo/photo.jpg,5,2 months ago,Really peaceful and super quiet  not many people around. Take the whiskey trail to the pines and enjoy the best beach views.,1543180849
Quetico Provincial Park,Roxanne,https://www.google.com/maps/contrib/116560789055546073776/reviews,https://lh6.googleusercontent.com/-yZXBUPeW42I/AAAAAAAAAAI/AAAAAAAAHZ8/uw7J7JHDGjY/s128-c0x00000000-cc-rp-mo-ba2/photo.jpg,5,5 months ago,We canoed from French Lake to The Pines beach. We rented canoes from a Outfitter that keeps the canoes in the park and provide life jackets and paddles. Very reasonable price.  Highly recommended,1533585735
Quetico Provincial Park,Jason Hazelton,https://www.google.com/maps/contrib/118295011329541824128/reviews,https://lh6.googleusercontent.com/-t0w4hmxEfbw/AAAAAAAAAAI/AAAAAAAAAAA/ACevoQMivkvZZBjborfs-A-gJjz0kW4O_A/s128-c0x00000000-cc-rp-mo-ba4/photo.jpg,5,6 months ago,"We stayed at Dawson Trails Campground.  Not a large campground, but great sites, beaches, and trails. Had a couple of times over my 10 day visit where I wish the staff would have tried a bit harder, but overall they were pleasant and helpful.",1532438485
Quetico Provincial Park,Rosalyn Calder,https://www.google.com/maps/contrib/107779146820650111798/reviews,https://lh6.googleusercontent.com/-NWbQwuEOCCU/AAAAAAAAAAI/AAAAAAAAAAA/ACevoQPFVCbPt9G1pI5Q3ebDkuTP348WiQ/s128-c0x00000000-cc-rp-mo-ba4/photo.jpg,4,6 months ago,"Peaceful, Beautiful, Quiet... A recommend for sure. They also rent canoes, kayaks and paddleboards. Two gorgeous beaches and even a doggy beach.  Something to do for sure!",1532385759
Rainbow Falls Provincial Park,Denis Drainville,https://www.google.com/maps/contrib/107458321527585579750/reviews,https://lh3.googleusercontent.com/-BP98j8H2kqE/AAAAAAAAAAI/AAAAAAAAAAg/TjJhGMbHILU/s128-c0x00000000-cc-rp-mo/photo.jpg,5,a month ago,"Awesome park, clean and very friendly staff. My wife and I spent 4 days and it was totally worth it. Great kayaking opportunities at the park or nearby on Lake Superior. Highly recommended",1545580349
Rainbow Falls Provincial Park,Bludiamond59,https://www.google.com/maps/contrib/114729108361915947249/reviews,https://lh6.googleusercontent.com/-hfeW31yvnZc/AAAAAAAAAAI/AAAAAAAAABg/MJ6h4SqfLcw/s128-c0x00000000-cc-rp-mo/photo.jpg,5,5 months ago,I am bicycle touring around Lake Superior.  Rainbow Falls Provincial Park was a very nice stop for the night along the lake. I had a nice stop to hang a hammock and the attendant let charge my electronics in the shack . Very well taken care of.,1533823881
Rainbow Falls Provincial Park,Nathalie Holler,https://www.google.com/maps/contrib/103316474192611526977/reviews,https://lh3.googleusercontent.com/-reVV6ulJpCc/AAAAAAAAAAI/AAAAAAAAAAA/ACevoQPE2F1SUSPYv7jYVxQXgvvA8FTCTQ/s128-c0x00000000-cc-rp-mo-ba4/photo.jpg,5,2 months ago,Beautiful falls and a great provincial park. Great camping facilities too,1541837610
Rainbow Falls Provincial Park,Bill Ducat,https://www.google.com/maps/contrib/115630974402410836677/reviews,https://lh3.googleusercontent.com/-7aszEWFobJA/AAAAAAAAAAI/AAAAAAAAQyI/KyMb5GW2NyQ/s128-c0x00000000-cc-rp-mo-ba4/photo.jpg,5,a month ago,Great place to hang out and stop moving! Check out the falls and find the Red Chairs!,1544054330
Rainbow Falls Provincial Park,Greg Stewart,https://www.google.com/maps/contrib/116314591814757817550/reviews,https://lh4.googleusercontent.com/-XSFJ7Sl4vxk/AAAAAAAAAAI/AAAAAAAAAAA/ACevoQPMpeVEDHgObjTy2-sQ-uW86zP3GA/s128-c0x00000000-cc-rp-mo/photo.jpg,4,6 months ago,The park was breathtaking.  Staff were friendly and helpful.  Fire pit was full of toilet paper and soup cans tinfoil etc. After we cleaned it up we had one of.the best evenings on our holiday.,1531793992
René Brunelle Provincial Park,Dhiraj D'Souza,https://www.google.com/maps/contrib/116192919558815166610/reviews,https://lh4.googleusercontent.com/-TS01ItX5Sk0/AAAAAAAAAAI/AAAAAAAA25c/E-UKBtYHdyY/s128-c0x00000000-cc-rp-mo-ba5/photo.jpg,5,5 months ago,"Beautiful Park. Quiet, not too busy. Super clean washrooms and amazing staff especially Park Warden Terry.",1533950589
René Brunelle Provincial Park,James O'Hearn,https://www.google.com/maps/contrib/110509053766791142011/reviews,https://lh6.googleusercontent.com/--aHXHtm-PlA/AAAAAAAAAAI/AAAAAAAAAAA/ACevoQMLyIZDkXTPvb4qr76wXMJMEHkXiw/s128-c0x00000000-cc-rp-mo-ba3/photo.jpg,5,6 months ago,Nice park. 2 nice trails. Moonbeam trails were nice.,1531241223
René Brunelle Provincial Park,Arya Janjani,https://www.google.com/maps/contrib/111043422492306436625/reviews,https://lh4.googleusercontent.com/-A7W78BP8WzQ/AAAAAAAAAAI/AAAAAAAAAAA/ACevoQO2OFDCKpJqJAD2eUdJtsPWjsuHwQ/s128-c0x00000000-cc-rp-mo/photo.jpg,5,5 months ago,Beautiful park and Lake. Very calm and peaceful 👌,1534474033
René Brunelle Provincial Park,Arielle Hall,https://www.google.com/maps/contrib/115712624632601102402/reviews,https://lh3.googleusercontent.com/-wQ7UQ7EixYo/AAAAAAAAAAI/AAAAAAAAAAA/ACevoQPKgOTcHq-1xxnvP8JD9XyaKWymuw/s128-c0x00000000-cc-rp-mo-ba3/photo.jpg,4,4 months ago,Populated lake but very private sites. Paddleboards and boats for rent.,1537112682
René Brunelle Provincial Park,Joan Mallyon,https://www.google.com/maps/contrib/116424613664805477413/reviews,https://lh3.googleusercontent.com/-QzIh5IygeOM/AAAAAAAAAAI/AAAAAAAAAAA/ACevoQPrdUTCD3aCDmkspHYpu0ZEPRLzNw/s128-c0x00000000-cc-rp-mo-ba3/photo.jpg,5,6 months ago,Good place to stop. Clean facilities,1532964483
Restoule Provincial Park,Justin Majik,https://www.google.com/maps/contrib/114153014404112308587/reviews,https://lh6.googleusercontent.com/-2r72VcvVxU8/AAAAAAAAAAI/AAAAAAAAAAA/ACevoQObRzid7--rN9rbbkhOcZj6OQb1hg/s128-c0x00000000-cc-rp-mo-ba2/photo.jpg,5,in the last week,Great park. Stayed here for 8 nights in August of 2018. Plenty of trails and great fishing. Will definitely go back. My favourite park out of the 12 we visited last year.,1548348540
Restoule Provincial Park,Irene G,https://www.google.com/maps/contrib/114810933615836562351/reviews,https://lh6.googleusercontent.com/-jQR0Bdm5L9Y/AAAAAAAAAAI/AAAAAAAAAdg/ftYNcOY8uBc/s128-c0x00000000-cc-rp-mo/photo.jpg,2,in the last week,"Overall a nice park... however, we found that the rangers were unreasonable with the rules. For example, we were all speaking very softly and two rangers popped up from the bush and said we were speaking too loudly... this happened twice. Makes me feel very uneasy that these rangers were sitting there in the dark, observing us.",1548362269
Restoule Provincial Park,bah and nannybah rollindowntheroad,https://www.google.com/maps/contrib/107636968973692802785/reviews,https://lh6.googleusercontent.com/-px6FaKRdlqU/AAAAAAAAAAI/AAAAAAAADI4/L6oOUCrHaf8/s128-c0x00000000-cc-rp-mo-ba3/photo.jpg,1,in the last week,"if u like to eat dust all day from continuing traffic driving on gravel roads between every site then this is the place for you! 
small sites
do not book the sites that have the main gravel roads! !
note photo rendition of our first spot👇
it went downhill from there...",1548640986
Restoule Provincial Park,Kayla Dormer,https://www.google.com/maps/contrib/109950721725083967478/reviews,https://lh3.googleusercontent.com/-6fEPcz5NMdQ/AAAAAAAAAAI/AAAAAAAAAAA/ACevoQPnwDiada1oOubMjlQnCv9hXKN7Jg/s128-c0x00000000-cc-rp-mo-ba3/photo.jpg,5,5 months ago,Had the best time ever! Rain never stopped us from having fun. Beautiful beach and dock launch. Big camp sites. Very well kept washrooms and showers. Will be recommending to other and coming back #444,1535737968
Restoule Provincial Park,Philip Deuxberry,https://www.google.com/maps/contrib/104179272356743217763/reviews,https://lh3.googleusercontent.com/-SBIG6y5S9kM/AAAAAAAAAAI/AAAAAAAAAAA/ACevoQPVb8-LL8cpotx47iXzPqrmffsPTQ/s128-c0x00000000-cc-rp-mo-ba2/photo.jpg,5,4 months ago,"Very nice lake, quite campground. Staff is very friendly and nice. The campsites have 2 picnic tables and are big,  Canoe and bike rentals right there in park, the bikes are really and high quality. nice beach area and hiking trails and a few bike trails. Nice showers and bathrooms at confort stations. Over all great place.",1536716813
Rideau River Provincial Park,ESHITA SHAH,https://www.google.com/maps/contrib/114815600155410058392/reviews,https://lh3.googleusercontent.com/-UrfToIX-rvM/AAAAAAAAAAI/AAAAAAAAIdk/jaDJxHmQ_d0/s128-c0x00000000-cc-rp-mo-ba3/photo.jpg,5,6 months ago,"Place is well kept and maintained. Bathrooms we're dry, clean. The Park persons had bird spotting informative activity for kids. The camp site was good too. It can be great place for a day trip or picnic with family and friends. Parking fee/entry fee is about $15.00.",1532893077
Rideau River Provincial Park,Kevin Thompson,https://www.google.com/maps/contrib/117119195976356882477/reviews,https://lh4.googleusercontent.com/-wvdrSjfTmu4/AAAAAAAAAAI/AAAAAAAAAAA/ACevoQPBFgsydHd-j2GMCLcbY6Mg3Si4mQ/s128-c0x00000000-cc-rp-mo/photo.jpg,5,3 months ago,"was a little hard to find at first, but being our first time out here from alaska what do you expect right? quiet campground and well maintained. we will keep it on our list of nice RV parks to stay at!",1538369476
Rideau River Provincial Park,swarnjeet Singh,https://www.google.com/maps/contrib/108694192639844833435/reviews,https://lh5.googleusercontent.com/-jQicw5EJL-I/AAAAAAAAAAI/AAAAAAAAI4Y/9z9mrWy2h5E/s128-c0x00000000-cc-rp-mo-ba4/photo.jpg,3,6 months ago,"It's a very good place for a family kids. You can do a lot of activities are there are two beaches for swimming. There's no lifeguard but the water is pretty shallow.
There are campgrounds different campgrounds in this area you can go for camping. You can play beach volleyball there's a net available you have a lot of sitting area barbecue and also a big shed. 
Canoes and kayaks are also available for rent. 
Overall it's a very fun holiday for family with kids with a lots of activities.",1532302339
Rideau River Provincial Park,Jérémy Vachon,https://www.google.com/maps/contrib/102935896341338646233/reviews,https://lh6.googleusercontent.com/-qz3_0r7Uz7w/AAAAAAAAAAI/AAAAAAAAAAA/ACevoQNiztM1xhC2XCBZJoTFpfCFuA4Fhw/s128-c0x00000000-cc-rp-mo-ba4/photo.jpg,4,4 months ago,"Just on the outskirts of Ottawa, perfect if you just want to get away for a night or the weekend.  One side of the park is close to the highway, so a bit noisy at night.  Wood is kept in a dry place.  Only has one 3km hike.  Large beach.",1535998643
Rideau River Provincial Park,Celene Tang,https://www.google.com/maps/contrib/110680596628203759522/reviews,https://lh5.googleusercontent.com/-B6VTK8WkR2w/AAAAAAAAAAI/AAAAAAAAAAA/ACevoQPc6jaPar79k39e3b8a_LQ2vw6Lww/s128-c0x00000000-cc-rp-mo-ba3/photo.jpg,4,5 months ago,Quiet but small park. Wish I could have swam but the bacteria levels were too high. The prices of kayak rentals are honestly way too high so no one was on the water. The facilities are decent. But there isn't much to do without swimming... So I wouldn't recommend more than a night's stay to be honest unless you're just here to sit by the fire quietly,1535078379
Rock Point Provincial Park,France Mathewson,https://www.google.com/maps/contrib/102624311200863131465/reviews,https://lh5.googleusercontent.com/-F_UE6iMX0o8/AAAAAAAAAAI/AAAAAAAAARA/EIl5pV4NLaE/s128-c0x00000000-cc-rp-mo/photo.jpg,5,2 months ago,"Awesome campground. It rained almost the whole time we were there, but the kids didn't care. The fossilized rock beds are incredible, and the tiny fossils all along the shoreline kept the kids entertained as mini paleontologists for a whole afternoon. Facilities were clean and the park is well-maintained. Sites in our area were fairly close together, so maybe not the greatest if you're looking for rugged camping, but great for families. No problems bringing the dog.",1541781429
Rock Point Provincial Park,donny richardson,https://www.google.com/maps/contrib/112621897607993859231/reviews,https://lh5.googleusercontent.com/-_Me6pMR8QT0/AAAAAAAAAAI/AAAAAAAAEg4/UBWJ5-tA-QU/s128-c0x00000000-cc-rp-mo-ba5/photo.jpg,4,a week ago,"Tons of beach too enjoy. Good size sites.
Clean and relaxing place.",1547798331
Rock Point Provincial Park,Dhruv Patel,https://www.google.com/maps/contrib/104808913508330033702/reviews,https://lh5.googleusercontent.com/-ZAWr68NDA3U/AAAAAAAAAAI/AAAAAAAAAKk/UO7FHwO0rF8/s128-c0x00000000-cc-rp-mo-ba3/photo.jpg,5,7 months ago,I was so impressed with this provincial park. Campsites are very nice and clean. Sites are big enough for small group to play games. The Site we had was having good privacy and washrooms were close enough. Beach of this provincial park is very clean and water is good to swim during hot summer time. Beach is very good for morning walk and trails are decent.,1529859379
Rock Point Provincial Park,Jennifer Vandervelden,https://www.google.com/maps/contrib/111845393357833127625/reviews,https://lh3.googleusercontent.com/-czMvm4skUik/AAAAAAAAAAI/AAAAAAAAAAA/ACevoQMvgsWKJJaDe-0WQXvi_AX_j4rtIQ/s128-c0x00000000-cc-rp-mo-ba4/photo.jpg,4,3 months ago,Absolutely beautiful! Fossils and shells are fascinating to explore! Rock platforms and ledges are fun to walk out on or sit/lay in the sun,1539545240
Rock Point Provincial Park,Jeff Hollick,https://www.google.com/maps/contrib/110723947305511379865/reviews,https://lh6.googleusercontent.com/-INM-9b6g-yk/AAAAAAAAAAI/AAAAAAAAAAA/ACevoQPLX-M2cPwR8jOKdQz-9_xzH6TugA/s128-c0x00000000-cc-rp-mo-ba3/photo.jpg,5,a month ago,Always a fantastic family walk. The views and the nature are abundant.,1545171062
Rondeau Provincial Park,laura m,https://www.google.com/maps/contrib/113924497949899768132/reviews,https://lh5.googleusercontent.com/-t03Qj6LB-bQ/AAAAAAAAAAI/AAAAAAAAALM/i7mszLaAmJs/s128-c0x00000000-cc-rp-mo-ba3/photo.jpg,5,2 months ago,"Absolutely love this place! It's so beautiful! I went near the end of October and all the fall colours were great. Love the dog beach, it's so big! So many animals around as well, I saw deer more than a handful of times",1541174215
Rondeau Provincial Park,Megan Dyksterhuis,https://www.google.com/maps/contrib/102706891991595513764/reviews,https://lh3.googleusercontent.com/-abc6zwDXADI/AAAAAAAAAAI/AAAAAAAABSM/8458pDUKzeU/s128-c0x00000000-cc-rp-mo/photo.jpg,5,a month ago,"Awesome fishing, clean campgrounds, decent beach, do your research on the site you book as there are a lot that are full sun all day with few trees for hanging hammocks or clothes lines. Washroom and shower facilities are clean and mostly bug free.",1544796960
Rondeau Provincial Park,Jonathan Lees,https://www.google.com/maps/contrib/113106504028542317112/reviews,https://lh5.googleusercontent.com/-1Kxklq9nN6g/AAAAAAAAAAI/AAAAAAABWZw/gF2r06BJydA/s128-c0x00000000-cc-rp-mo-ba3/photo.jpg,5,5 months ago,"Amazing park. The sites are great, with a mixture of relatively private to spacious and open.  The staff are always friendly and the park store has a pretty good variety of ""oops"" items that you may have forgotten or run out of... and the food that they make is reasonably priced and delicious.

The beach is also walking distance!!! It's fantastic.

Oh, and the visitor centre? Amazing! The kids absolutely love all the live animals they have -- typically from turtles to reptiles -- but the displays are also fantastic and well done.

The cons:
The beach is a little on the smaller side (depending on the tide) and you're kind of sitting in cottage country, where almost everything you're doing involves going between or around peoples' homes... so there's a disconnect from the camping experience.",1535114683
Rondeau Provincial Park,Brandon Galbraith,https://www.google.com/maps/contrib/117941702275847431609/reviews,https://lh5.googleusercontent.com/-kOrkoOyo9bM/AAAAAAAAAAI/AAAAAAAAAAA/ACevoQMFSUTVtATg6EOw0GnqUdlWXEdpFQ/s128-c0x00000000-cc-rp-mo/photo.jpg,4,3 months ago,"We went in the month of June and had no problem getting a site while other provincial parks were booked up.   The sites aren’t as private as other parks, however we had very few sites booked around us.  Still a great experience.",1540398351
Rondeau Provincial Park,Kate Smith,https://www.google.com/maps/contrib/116318114575472383312/reviews,https://lh4.googleusercontent.com/-2u11CBBBmbI/AAAAAAAAAAI/AAAAAAAAAM4/e5NsRRwEAbQ/s128-c0x00000000-cc-rp-mo-ba3/photo.jpg,5,4 weeks ago,Well kept park with beautiful trails. Visitor centre offers guided hikes that my kids love,1546175950
Rushing River Provincial Park,Justin Hildebrand,https://www.google.com/maps/contrib/114490459633355366313/reviews,https://lh4.googleusercontent.com/-ccNyISJdGdw/AAAAAAAAAAI/AAAAAAAAAD4/ltNcit9QMd4/s128-c0x00000000-cc-rp-mo/photo.jpg,3,2 months ago,"Great campground. Lots to do for all ages. I've been coming here for almost 15 years straight, and unfortunately it seems that the park is kind of a forgotten gem... They used to have the museum open more often, as well as have weekend movies at the theater (where they got kids to collect garbage around the area in exchange for popcorn that you could enjoy during the movie), but over the past several years they haven't played anything at the theater and the museum is hardly open, and hasn't been updated since I was a baby... A lot of the roads through the campground are old, have pot holes and need to be filled or redone. Most bathrooms and showers are clean, the outhouses can be quite dirty though. Multiple beaches to choose from which is great, but sadly none are dog-friendly... Overall I love this place, but It hasn't done or changed much over the years and is starting to fall apart it seems. Still very nice, but work and changes are definitely needed.",1541443750
Rushing River Provincial Park,Meghan Schaefer,https://www.google.com/maps/contrib/110923488066813027692/reviews,https://lh3.googleusercontent.com/-5MvkdA2KRN4/AAAAAAAAAAI/AAAAAAAAACU/ng3NwUoKhJ8/s128-c0x00000000-cc-rp-mo-ba3/photo.jpg,4,5 months ago,I've been coming here every year since I was a baby. Such a wonderful campground with great memories but it is starting to go downhill. The bathrooms are very run down and dirty. The amphitheatre isn't being used anymore which is a real shame. They used to play family movies some nights and have events. Nothing like that happens anymore.,1535693601
